"FM","KD_JENIS_TRANSAKSI","FG_PENGGANTI","NOMOR_FAKTUR","MASA_PAJAK","TAHUN_PAJAK","TANGGAL_FAKTUR","NPWP","NAMA","ALAMAT_LENGKAP","JUMLAH_DPP","JUMLAH_PPN","JUMLAH_PPNBM","IS_CREDITABLE"
"FM","01","0","0011740189800","1","2017","28/01/2017","211433768906000","CV AKAMEDIA","JL. MUDING INDAH VII NO.1 RT.000 RW.000, KEROBOKAN , BADUNG","900000","90000","0","1"
"FM","03","0","0091704348515","1","2017","20/01/2017","660726324901000","CV GLOBAL TECH BALI","JL. NUANSA KORI BARAT BLOK VI  NO 5, UBUNG KAJA , DENPASAR","10110000","1011000","0","1"
"FM","03","0","0091707213374","1","2017","28/01/2017","029709979905000","PT ANDAL AMAN ABADI","JL.RAYA NUSA DUA SELATAN NO.1,LINGK.PEMINGE, BENOA , BADUNG","15523760","1552376","0","1"
"FM","03","0","0011741362786","1","2017","13/01/2017","029706140905000","PT SONADHE","PERUM PURI NUSA DUA GG.VIII NO.63D , BADUNG","20914098","2091409","0","1"
"FM","01","0","0011740189804","1","2017","29/01/2017","211433768906000","CV AKAMEDIA","JL. MUDING INDAH VII NO.1 RT.000 RW.000, KEROBOKAN , BADUNG","900000","90000","0","1"
